{
  "schema_version": "0.1",
  "adapter": {
    "name": "jest",
    "type": "unit",
    "version": "29.7.0"
  },
  "execution": {
    "status": "completed",
    "duration_ms": 1842
  },
  "summary": {
    "status": "pass",
    "total": 12,
    "passed": 12,
    "failed": 0,
    "skipped": 0
  },
  "evidence": {
    "complete": true,
    "issues": []
  },
  "artifacts": {
    "raw_stdout_path": "raw/jest/stdout.log",
    "raw_stderr_path": "raw/jest/stderr.log",
    "raw_tool_output_path": "raw/jest/tool-output.json"
  },
  "extensions": {
    "jest": {
      "suite_names": ["auth.spec.ts", "billing.spec.ts"],
      "retry_count": 0
    }
  }
}